{
  "ACTION_ID": "ACT-20261007-9c8d7e6f",
  "AGENT": "AG-SRC",
  "DATE": "2026-10-07T10:00:00+00:00",
  "PROJECT": "RKP-2026-0001",
  "ACTION": "verify_sources",
  "FILES_CHANGED": ["knowledge-base/sources/sources.jsonl"],
  "SOURCE_USED": ["SRC-000001"],
  "DECISION": "VERIFIED via Crossref",
  "DECISION_LEVEL": "L1",
  "APPROVAL": null,
  "MODEL": "anthropic:claude-sonnet-5-5",
  "COST_USD": 0.0123
}
